{
  "schema_version": "ISRAS-ENVIRONMENT-V1",
  "profile": "specialized",
  "classification": "specialized",
  "operating_systems": ["PROJECT_DEFINED"],
  "architectures": ["PROJECT_DEFINED"],
  "required_commands": [
    {"command": "git", "version_args": ["--version"], "version_pattern": "^git version "}
  ],
  "optional_commands": [],
  "required_python_modules": [],
  "required_environment_variables": ["ISRAS_RUNNER_IDENTITY"],
  "capabilities": ["project-specialized-validation"],
  "containers_required": false,
  "notes": ["Specialized labs must define exact topology, reset, identity, and evidence requirements."]
}
