{
  "schema_version": "ISRAS-ENVIRONMENT-V1",
  "profile": "canonical",
  "classification": "canonical",
  "operating_systems": ["PROJECT_DEFINED"],
  "architectures": ["PROJECT_DEFINED"],
  "required_commands": [
    {"command": "git", "version_args": ["--version"], "version_pattern": "^git version "}
  ],
  "optional_commands": [],
  "required_python_modules": [],
  "required_environment_variables": ["ISRAS_RUNNER_IDENTITY"],
  "capabilities": ["project-canonical-validation"],
  "containers_required": false,
  "notes": ["Replace PROJECT_DEFINED and the tool inventory before canonical acceptance."]
}
